{
  "packet_id": "pkt_context_0001",
  "packet_type": "ContextPacket",
  "version": "0.1",
  "project_id": "hypler",
  "actor_id": "agent.codex",
  "session_id": "sess_bp0002_0001",
  "intent": "Compile source-backed context for a bounded packet task.",
  "risk_level": 1,
  "source_refs": ["doc:docs/architecture/PACKET_MODEL.md"],
  "resource_refs": ["repo:lnsat"],
  "policy_profile": "context_readonly",
  "permission_envelope": {
    "allow": ["context.read", "context.compile"],
    "block": ["secret.read.never", "deploy.execute.approved"]
  },
  "budget": {
    "tokens": 8000,
    "runtime_seconds": 300,
    "cost_usd": 0.25,
    "cpu": 1,
    "memory_mb": 512
  },
  "constraints": {
    "output_contract": "summary_with_source_refs"
  },
  "requires_approval": false,
  "ttl_seconds": 3600,
  "created_at": "2026-05-03T00:00:00Z"
}
