{
  "packet_id": "pkt_execute_0001",
  "packet_type": "ExecutionPacket",
  "version": "0.1",
  "project_id": "hypler",
  "actor_id": "agent.codex",
  "session_id": "sess_bp0002_0001",
  "intent": "Run package checks inside an approved sandbox.",
  "risk_level": 3,
  "source_refs": ["doc:docs/architecture/PACKET_MODEL.md"],
  "resource_refs": ["repo:lnsat"],
  "policy_profile": "agent_sandbox",
  "permission_envelope": {
    "allow": ["tests.run.sandbox"],
    "block": ["ssh", "secret.read.never", "database.write", "deploy.execute.approved"]
  },
  "budget": {
    "tokens": 4000,
    "runtime_seconds": 900,
    "cost_usd": 0.5,
    "cpu": 2,
    "memory_mb": 4096
  },
  "constraints": {
    "network": "disabled",
    "writes": "workspace_only"
  },
  "requires_approval": false,
  "ttl_seconds": 7200,
  "created_at": "2026-05-03T00:00:00Z"
}
